Control ID,Pillar,IG,Safeguard Title,Customer Objective,Detailed Requirement,Lifecycle Trigger,Cadence,Primary Stakeholder,Microsoft Tool Recommendation,Generic Tooling Category,Evidence of Completion,Applies To,Notes / Guardrails
STR-IG1-01,Strategy & Buy-In,IG1,Executive sponsor assigned,Create clear business ownership for AI in this customer environment.,"Name a customer-side executive sponsor who approves scope, target roles, success criteria, and broad rollout decisions.",Onboarding,At initial rollout and annual renewal,Customer executive sponsor,Microsoft 365 admin center for pilot scope visibility; SharePoint list for decision log,Project portfolio management / governance tracker,Signed project charter or decision log naming sponsor.,All users,No broad rollout without a sponsor who can make tradeoff decisions.
STR-IG1-02,Strategy & Buy-In,IG1,Business outcomes by persona,"Tie AI use to measurable work outcomes, not generic productivity language.","Document 1 to 3 target outcomes for each pilot persona, including baseline effort, quality issue, or throughput metric.",Onboarding,At initial rollout and before each new department expansion,Department owner + project lead,Power BI for KPI baseline visualization; Excel/SharePoint for outcome register,BI/reporting tool,Baseline-and-target matrix by persona.,Pilot users / target roles,"Use role-specific outcomes such as ticket triage speed, proposal drafting time, or meeting recap accuracy."
STR-IG1-03,Strategy & Buy-In,IG1,In-scope user cohort defined,Constrain rollout to a deliberate set of users in the customer environment.,"Identify the initial pilot group, their job functions, support path, and go/no-go criteria for expansion.",Onboarding,Per rollout wave,IT lead + business owner,Entra ID groups,Identity/group management,"Pilot roster, group export, and rollout criteria.",Pilot users,Do not start with all users.
STR-IG1-04,Strategy & Buy-In,IG1,Communication plan published,Set user expectations before AI is introduced.,"Publish a plain-language launch message covering what is enabled, what is not, where to get help, and what success looks like.",Onboarding,Per rollout wave,Communications lead,SharePoint communication site; Teams announcement,Intranet / change communications,Published communication and acknowledgement path.,All enabled users,"This should be customer-facing, not MSP-internal."
STR-IG2-01,Strategy & Buy-In,IG2,Steering cadence established,"Keep business, IT, and security aligned after launch.","Run a recurring customer AI steering meeting to review adoption, risk, use-case backlog, and policy decisions.",QBR,Monthly or quarterly depending on customer size,Customer sponsor + IT/security lead,Teams meetings; Loop/SharePoint for decision log,Governance meeting cadence,"Recurring agenda, attendees, and decision log.",Customer environment,"This is a customer governance forum, not an MSP operations meeting."
STR-IG2-02,Strategy & Buy-In,IG2,Use-case backlog prioritized,Sequence AI work by value and risk in the customer environment.,"Maintain a living backlog of approved use cases with owner, business value, data sensitivity, and readiness status.",Project,Quarterly review,Business analyst + department owner,Planner / Lists / SharePoint,Backlog management,Approved backlog with prioritization fields.,Departments adopting AI,Use this to decide which departments expand next.
STR-IG2-03,Strategy & Buy-In,IG2,Licensing and budget plan,Avoid uncontrolled spend as adoption expands.,"Define who receives paid AI licenses, which users remain on free/limited experiences, and what budget guardrails apply.",Onboarding,Quarterly,IT finance + sponsor,Microsoft 365 admin center usage and license reports,SaaS license management,License allocation plan and quarterly review note.,All AI-enabled users,Budget planning belongs at the customer level.
STR-IG2-04,Strategy & Buy-In,IG2,Department expansion criteria,Require evidence before moving from pilot to broader departments.,"Document expansion gates such as training completion, KPI improvement, support stability, and data readiness.",Project,Per expansion wave,Project lead + sponsor,Power BI scorecards; SharePoint checklists,Project gate management,Signed stage-gate checklist.,New departments,Expansion should be evidence-based.
STR-IG3-01,Strategy & Buy-In,IG3,12-month AI roadmap,Give the customer a sequenced roadmap across departments and maturity levels.,"Maintain a 12-month roadmap that shows pilots, hardening milestones, agentic use cases, and dependent cleanup work.",QBR,Quarterly refresh,Executive sponsor + transformation lead,Planner / Project for the web / Power BI,Roadmapping / PMO tooling,Roadmap with owners and target quarters.,Customer environment,Useful once the environment moves beyond one or two pilots.
STR-IG3-02,Strategy & Buy-In,IG3,AI risk appetite statement,Clarify what the customer will and will not automate.,"Document the customer’s position on acceptable autonomy, regulated data use, external AI services, and customer-facing automation.",Project,Annual and upon major policy change,Executive sponsor + risk/compliance lead,SharePoint controlled document library,Risk management / policy repository,Approved AI risk appetite statement.,Customer environment,This becomes the anchor for later agentic decisions.
GOV-IG1-01,Policy & Governance,IG1,Basic AI acceptable use policy,Set minimum rules for day-to-day AI use by customer employees.,"Publish an AI acceptable use policy covering approved tools, prohibited data, human review expectations, and reporting of harmful output.",Onboarding,Annual review,Compliance lead + HR,SharePoint policy library; Purview communication/compliance references,Policy management / HR policy system,Versioned policy and acknowledgement record.,All employees,Keep it short enough that employees will actually read it.
GOV-IG1-02,Policy & Governance,IG1,Approved AI tools inventory,Give the customer a clean list of what is allowed.,"Maintain a list of approved AI tools, copilots, chatbots, automations, and agent platforms that employees may use.",Onboarding,Monthly review,IT/security lead,SharePoint list; Defender exposure inventory where available,Asset / SaaS inventory,Approved tools register with owner and purpose.,All employees,Start with approved tools before building a long blocked list.
GOV-IG1-03,Policy & Governance,IG1,Prohibited data list for AI,Reduce accidental misuse of sensitive data.,"Document which data categories may never be pasted, uploaded, or shared into AI tools without formal exception.",Onboarding,Annual review and upon regulatory change,Compliance lead,Purview information protection reference; SharePoint policy page,Data handling standard,Published prohibited-data list with examples.,All employees,"Examples should include customer confidential, regulated data, legal holds, and trade secrets as applicable."
GOV-IG1-04,Policy & Governance,IG1,Output validation standard,Require employees to verify important AI outputs before use.,"Publish a standard that defines when employees must fact-check, cite, peer review, or manager review AI-generated work.",Onboarding,Quarterly refresh,Department manager + compliance lead,SharePoint knowledge base,Knowledge management / SOP platform,Published standard and example scenarios.,All employees,"Especially important for customer-facing, legal, financial, and security content."
GOV-IG2-01,Policy & Governance,IG2,AI change approval path,Prevent uncontrolled enablement of new AI features in the customer tenant.,"Require review and approval before turning on new AI capabilities, connectors, browser extensions, or agents in production.",Project,Per change,IT change owner + security approver,ServiceNow/Planner paired with Microsoft 365 admin change evidence,ITSM / CAB process,Approved change record with rollback notes.,Production environment,Apply the same rigor as other production changes.
GOV-IG2-02,Policy & Governance,IG2,Third-party AI vendor review,Control data handling risk for non-native AI tools.,"Perform security, privacy, retention, and supportability review before approving any third-party AI service, plugin, or connector.",Project,"Before approval, then annual review",Security lead + procurement,Defender for Cloud Apps app governance references; SharePoint checklist,Vendor risk management / procurement review,Completed due diligence checklist and approval decision.,Third-party AI services,"This applies to browser AI, SaaS copilots, and embedded AI add-ons."
GOV-IG2-03,Policy & Governance,IG2,Exception register,Stop one-off approvals from becoming permanent drift.,"Track AI policy exceptions with business justification, compensating controls, owner, approver, and expiry date.",Project,Monthly review,Compliance lead,SharePoint/Lists,GRC / exception management,Active exception register with no expired open items.,All exceptions,"If an exception has no expiry, it is not an exception."
GOV-IG2-04,Policy & Governance,IG2,Agent approval workflow,"Ensure agents and automations are approved like applications, not side projects.",Require a documented approval path before a custom agent or workflow is published to employees.,Project,Per agent or automation,Platform owner + security approver,Copilot Studio admin controls; Power Platform admin center,Workflow / application approval process,"Approval record, owner, purpose, and support designation.",Custom agents / workflows,Treat agents like deployable software with business impact.
GOV-IG3-01,Policy & Governance,IG3,Block unapproved GenAI tools,Enforce policy by limiting employee access to unsanctioned AI services where business risk warrants it.,"Use technical controls to restrict unapproved public GenAI sites, desktop apps, and browser extensions unless explicitly approved.",Project,Quarterly review and upon major new AI service adoption,Security lead + network/endpoint admin,Microsoft Defender for Endpoint / Defender for Cloud Apps / Defender for Web controls,DNS filtering tools / SSE / CASB / secure web gateway / browser control,Policy-backed block list and control validation test.,All employees or high-risk groups,"Use least-disruptive controls first, but do not rely on policy alone for high-risk environments."
GOV-IG3-02,Policy & Governance,IG3,Policy mapping to enterprise risk framework,Align AI governance to the customer’s broader compliance and risk program.,"Map AI safeguards to the customer’s security, privacy, audit, and legal control framework and track gaps.",QBR,Semiannual,Risk/compliance lead,SharePoint controlled register; Purview evidence exports where relevant,GRC platform,Control mapping matrix and remediation actions.,Regulated or audit-driven customers,"Useful for SOX, HIPAA, PCI, ISO, or contract-heavy customers."
TEC-IG1-01,Technical Readiness,IG1,Identity baseline for AI users,Reduce account compromise risk before AI is enabled.,"Confirm SSO, MFA, and basic identity hygiene for all in-scope users before granting AI access.",Onboarding,Before initial rollout and for each new user cohort,Identity admin,Microsoft Entra ID,Identity provider / SSO platform,Identity readiness checklist and policy evidence.,All enabled users,AI access should not outrun identity maturity.
TEC-IG1-02,Technical Readiness,IG1,Supported endpoint baseline,"Ensure employees are using supported apps, browsers, and managed devices where required.","Validate supported OS, browser, Office app version, and required update channel for targeted AI experiences.",Onboarding,Per rollout wave,Endpoint admin,Intune; Microsoft 365 apps admin center,UEM / endpoint management,Readiness report or device/app compliance export.,Enabled devices,"This is a customer environment requirement, not an MSP-only concern."
TEC-IG1-03,Technical Readiness,IG1,Network and service reachability,Prevent failed rollouts caused by blocked services or unstable routes.,"Verify required service endpoints, proxies, browser policies, and relevant API reachability for in-scope AI tools.",Onboarding,Per rollout wave and after major network changes,Network admin,Microsoft connectivity and service health references,Firewall / proxy / network controls,Connectivity checklist and test results.,Enabled networks,"Particularly important for VDI, proxy-heavy, or locked-down environments."
TEC-IG1-04,Technical Readiness,IG1,Rollback plan for AI enablement,Make sure the customer can stop or limit rollout safely.,"Document how AI access, licenses, integrations, and user targeting will be paused or rolled back if risk emerges.",Project,Per rollout wave,IT lead,Entra groups; Microsoft 365 admin center,Rollback / release management,Documented rollback plan and owner.,Enabled users and tools,"If you cannot reverse it, you do not fully control it."
TEC-IG2-01,Technical Readiness,IG2,Device compliance gating,Limit higher-trust AI access to compliant devices when appropriate.,"Require compliant or managed devices for sensitive AI use cases, especially where business data can be surfaced broadly.",Project,Quarterly review,Security + endpoint admin,Intune compliance + Conditional Access,UEM / conditional access,Policy evidence and test from non-compliant device.,Sensitive use cases,"Use stronger controls for finance, HR, legal, and executive populations."
TEC-IG2-02,Technical Readiness,IG2,Least-privilege admin review,Ensure rollout does not depend on broad standing admin rights in the customer tenant.,"Review delegated, privileged, and service accounts involved in AI administration and reduce access to least privilege.",Onboarding,Quarterly,Security admin,Entra roles / PIM,Privileged access management,Access review output and remediation log.,Privileged admins,Separate daily admin from privileged activation where possible.
TEC-IG2-03,Technical Readiness,IG2,Audit and logging baseline,"Enable the telemetry needed to prove usage, changes, and incidents.","Turn on required audit, sign-in, admin change, and relevant application logs for AI-related services.",Onboarding,Monthly review,Security admin,Purview Audit; Entra sign-in logs; Microsoft 365 audit surfaces,SIEM / audit logging,Successful test retrieval for an AI-related event.,Customer environment,Observability depends on this prerequisite.
TEC-IG2-04,Technical Readiness,IG2,Separated test and production path,Keep experimentation out of the employee production path.,"Use a distinct test path, group, or environment for new AI prompts, connectors, policies, or custom agents before production release.",Project,Per change or release,Platform owner,Copilot Studio / Power Platform environments / Entra groups,Test environment / SDLC controls,Documented promotion path and test evidence.,Custom AI / advanced configs,"Even if the platform is limited, a separate pilot group still counts as separation."
TEC-IG3-01,Technical Readiness,IG3,Just-in-time privileged changes,Require time-bound elevation and approvals for sensitive AI administration.,"Use time-bound privileged access, justification, and logging for sensitive AI-related admin changes.",Project,Monthly review,Security admin,Entra PIM,Privileged access management,Activation logs and privileged role review.,Privileged admins,Advanced hardening for larger customers or sensitive environments.
TEC-IG3-02,Technical Readiness,IG3,Secret and integration credential control,"Protect API keys, service identities, and certificates used by AI integrations.","Inventory and manage all secrets, service accounts, API keys, and certificates used by AI tools and automations, with rotation rules.",Project,Quarterly review,Platform owner + security,Azure Key Vault,Secrets management / PAM,"Secret inventory, ownership, and rotation evidence.",Custom integrations,Be especially careful with unattended automations and service accounts.
PRC-IG1-01,Process Mapping,IG1,Top workflow inventory,Target AI where the customer actually has repetitive work.,"Identify the highest-value workflows in the customer environment where AI may improve speed, consistency, or quality.",Onboarding,Quarterly refresh,Department owner + analyst,Excel / SharePoint / Power BI for scoring,Process mapping / workflow discovery,Workflow inventory with owner and value score.,Target departments,Pick the workflows before picking more tools.
PRC-IG1-02,Process Mapping,IG1,Human review gates,Preserve human accountability where it matters most.,"Define which workflow outputs require human approval before they reach customers, employees, systems of record, or regulated records.",Onboarding,Quarterly refresh,Department manager,SharePoint SOPs; Teams approvals where used,SOP / quality control,Published review matrix by workflow.,Customer-facing or regulated workflows,This is one of the most important universal controls.
PRC-IG1-03,Process Mapping,IG1,Approved use-case SOPs,Make early AI use cases consistent and teachable.,"Create step-by-step SOPs for each approved pilot workflow, including when AI may be used and what manual checks remain required.",Onboarding,"Per workflow at launch, then quarterly",Process owner,SharePoint knowledge base,SOP / knowledge base,Published SOP with version history.,Pilot workflows,Avoid free-form experimentation in critical workflows.
PRC-IG1-04,Process Mapping,IG1,Prompt starter library,Give employees a safe starting point for common tasks.,"Publish starter prompts, templates, and examples for approved use cases in the customer environment.",Onboarding,Quarterly refresh,Department owner + enablement lead,SharePoint pages / Loop,Knowledge base / prompt library,Published prompt library with examples.,Approved use cases,"The goal is consistency, not prompt perfection."
PRC-IG2-01,Process Mapping,IG2,Workflow baseline metrics,Prove whether AI is helping the customer’s actual work.,"Measure baseline time, volume, quality, or error rates for approved workflows before and after AI introduction.",Project,Quarterly,Business analyst,Power BI,BI / process analytics,Baseline and trend report.,Approved workflows,No baseline means no credible value story.
PRC-IG2-02,Process Mapping,IG2,Escalation and exception path by workflow,Give employees a clear path when AI output is wrong or risky.,"Document workflow-specific escalation points for unsafe output, missing data, misclassification, or bad recommendations.",Onboarding,Quarterly refresh,Department manager,Teams / SharePoint,ITSM / SOP,Published escalation path in workflow SOP.,All approved workflows,Make this visible where users work.
PRC-IG2-03,Process Mapping,IG2,AI incident response playbook,"Respond quickly when AI causes harm, oversharing, or operational disruption.","Define how the customer triages, contains, communicates, and documents AI-related incidents.",Security Incident,Quarterly tabletop and annual review,Security lead + department owner,Purview audit references; Teams incident collaboration,Incident response / ITSM / SIEM,Approved playbook and exercise record.,Customer environment,"Treat harmful output and oversharing as supportable events, not one-offs."
PRC-IG2-04,Process Mapping,IG2,Workflow change control,Prevent hidden process drift as AI use expands.,"Require workflow owners to approve meaningful changes to AI-assisted SOPs, automations, and decision boundaries.",Project,Per change and quarterly review,Process owner,SharePoint versioning; Planner change list,Change management,Approved SOP version and change record.,AI-assisted workflows,A prompt change can be a process change.
PRC-IG3-01,Process Mapping,IG3,Autonomy boundary matrix,"Define where AI may draft, recommend, decide, or act.",Create a matrix that explicitly defines allowed automation depth for each workflow and what remains human-only.,Project,Semiannual review,Executive sponsor + process owner,SharePoint controlled matrix,Risk / controls documentation,Approved autonomy matrix.,Automated or agentic workflows,This is critical before agentic rollout.
PRC-IG3-02,Process Mapping,IG3,Workflow quality scorecard,"Track hallucination, rework, and exception rates by process.",Create a quality scorecard per major AI-assisted workflow and review it with workflow owners.,QBR,Quarterly,QA lead + process owner,Power BI,QA / analytics,Scorecard with corrective actions.,High-value workflows,"Quality needs to be measured, not assumed."
DAT-IG1-01,Data Security & Tagging,IG1,Approved data-in-scope register,Define what business data AI may touch at launch.,"Document which repositories, sites, folders, knowledge bases, or applications are approved for AI use in the initial rollout.",Onboarding,Quarterly review,Data owner + IT,SharePoint list; Purview data map references,Data inventory / repository register,Approved data-in-scope register.,Approved repositories,"Simple is fine: allowed, limited, or out-of-scope."
DAT-IG1-02,Data Security & Tagging,IG1,Classification taxonomy,Give employees a usable language for data sensitivity.,"Define and publish a simple classification taxonomy, such as Public, Internal, Confidential, and Restricted, with examples.",Onboarding,Annual review,Compliance lead + data owner,Microsoft Purview Information Protection,Data classification / information governance,Published classification standard.,All employees,"If the taxonomy is too complex, it will not be used."
DAT-IG1-03,Data Security & Tagging,IG1,Permissions and sharing cleanup,Reduce obvious oversharing before AI is introduced.,"Review high-value repositories for broad links, stale permissions, legacy shared drives, and overly permissive groups.",Onboarding,Quarterly for high-value repositories,Repository owner + IT,SharePoint admin tools; Entra groups,Access governance / file permissions review,Remediation tracker and before/after review.,Priority repositories,Start with the content AI is most likely to surface.
DAT-IG1-04,Data Security & Tagging,IG1,Repository hygiene baseline,"Reduce noisy, stale, or duplicated content that weakens AI output quality.","Archive or label stale content, duplicate knowledge, and obvious non-business repositories before broad AI rollout.",Onboarding,Semiannual review,Repository owner,SharePoint / OneDrive administration,Records management / content lifecycle,Repository cleanup checklist and owner attestation.,Knowledge repositories,Bad content quality becomes bad AI answers.
DAT-IG2-01,Data Security & Tagging,IG2,Labeling deployment,Move from taxonomy to applied labels or equivalent metadata.,Apply sensitivity labels or equivalent metadata to important repositories and content so AI boundaries reflect data sensitivity.,Project,Quarterly review,Purview/data governance admin,Microsoft Purview sensitivity labels,Data labeling / classification enforcement,Label policy evidence and test results.,Sensitive content,Start with highest-value repositories if full rollout is too large.
DAT-IG2-02,Data Security & Tagging,IG2,DLP and exfiltration controls,Reduce the chance that employees move sensitive data into the wrong AI channels.,"Deploy controls that detect or block prohibited uploads, prompts, sharing, or outbound movement of sensitive content.",Project,Monthly tuning,Security admin,Microsoft Purview DLP / Defender for Cloud Apps,DLP / CASB / email and web controls,"Policy evidence, alerts, and tuning notes.",Sensitive data flows,"Protect data movement, not just data at rest."
DAT-IG2-03,Data Security & Tagging,IG2,External sharing review,Tighten boundaries where guests or external users intersect with AI-relevant repositories.,"Review guest access, shared links, external collaboration settings, and cross-tenant shares for AI-exposed repositories.",QBR,Quarterly,Repository owner + IT/security,SharePoint / Teams admin centers,External sharing governance,Review output and remediation plan.,Collaboration repositories,AI can amplify whatever the repository already exposes.
DAT-IG2-04,Data Security & Tagging,IG2,Retention alignment for AI records,Apply the customer’s recordkeeping rules to AI-generated or AI-associated content.,"Define how AI-generated outputs, conversations, or work products are retained, deleted, or placed on hold where applicable.",Project,Semiannual review,Compliance lead,Purview retention policies,Records management / retention tooling,Retention policy definition and test case.,Work products and governed records,"Not every AI interaction is a record, but some outputs clearly are."
DAT-IG3-01,Data Security & Tagging,IG3,Regulated data access model,"Apply stronger rules for PHI, PCI, legal privilege, HR, or other highly sensitive datasets.","Define specific handling rules, approvals, and technical restrictions for regulated or highly sensitive datasets in AI workflows.",Project,Quarterly review,Compliance lead + data owner,Purview advanced labeling / DLP / access policies,Sensitive data governance / DSPM / data access controls,Approved regulated-data matrix and control tests.,Regulated data,Do not treat regulated data like ordinary internal content.
DAT-IG3-02,Data Security & Tagging,IG3,Continuous oversharing monitoring,Keep finding new data exposure risks after launch.,"Monitor for newly overshared sites, broad links, external sharing, or data sprawl that could affect AI retrieval.",QBR,Monthly or quarterly depending on change rate,Security/data governance lead,Purview DSPM for AI / SharePoint governance signals,DSPM / data access governance,Recurring risk report and remediation tracker.,High-value repositories,This becomes more important as adoption and content volume grow.
OBS-IG1-01,AI Observability,IG1,Adoption baseline,See who is enabled and whether the customer is actually using AI.,"Report enabled users, active users, basic usage trends, and adoption by target department or cohort.",Onboarding,Monthly,AI admin + sponsor,Microsoft 365 usage reports / Viva Insights where applicable,Usage analytics,Monthly adoption report.,Enabled users,This is the baseline service health view.
