Control ID,Pillar,IG,Safeguard Title,Customer Objective,Detailed Requirement,Lifecycle Trigger,Cadence,Primary Stakeholder,Microsoft Tool Recommendation,Generic Tooling Category,Evidence of Completion,Applies To,Notes / Guardrails
OBS-IG1-02,AI Observability,IG1,Shadow AI discovery baseline,Find unsanctioned AI behavior in the customer environment.,"Establish a baseline review for unsanctioned AI websites, browser extensions, desktop tools, or file movement patterns related to AI use.",Onboarding,Monthly,Security lead,Defender for Cloud Apps / Defender for Endpoint visibility,CASB / endpoint discovery / DNS reporting,Shadow AI findings log with owner.,Customer environment,Visibility must come before enforcement.
OBS-IG1-03,AI Observability,IG1,Audit evidence path,Be able to answer “who did what?” questions when AI use is questioned.,"Test that the customer can retrieve relevant audit evidence for AI enablement changes, access, and notable usage events where supported.",Onboarding,Monthly review,Security admin,Purview Audit / Entra logs,Audit / SIEM,Successful test retrieval and documented path.,Customer environment,"If you cannot retrieve evidence, investigations will fail."
OBS-IG1-04,AI Observability,IG1,Output quality sampling starter,Check early whether AI output is useful and safe in practice.,"Sample a small number of outputs from pilot workflows and rate quality, factuality, and required rework.",Onboarding,"Monthly during pilot, then quarterly",Department owner + QA lead,Excel / Power BI / Forms,QA / sampling workflow,Sampling log and score summary.,Pilot workflows,"Observability should include value and quality, not just security."
OBS-IG2-01,AI Observability,IG2,Risky-pattern alerting,"Detect likely misuse, policy overrides, or abnormal AI behavior faster.","Create alerts or reviews for suspicious AI-related activities such as blocked uploads, unusual tool usage, or high-risk data access patterns.",Security Incident,Continuous review with monthly tuning,Security operations,Microsoft Sentinel / Defender / Purview alerts,SIEM / XDR / alerting,"Alert catalog, owner, and triage SOP.",Customer environment,Start with a small set of high-signal alerts.
OBS-IG2-02,AI Observability,IG2,Cost and value scorecard,"Review adoption, spend, and business value together.","Track license assignment, active usage, key workflow KPIs, support burden, and notable risk events in one scorecard.",QBR,Quarterly,Sponsor + IT lead,Power BI + M365 reports,BI / FinOps / service reporting,QBR scorecard with actions.,Customer environment,This helps stop shelfware and uncontrolled expansion.
OBS-IG2-03,AI Observability,IG2,Model/agent inventory,Maintain visibility into what AI capabilities are actually active for employees.,"Inventory active copilots, assistants, custom agents, enabled connectors, and key policy states in the customer environment.",Project,Monthly,Platform owner,Copilot Studio / M365 admin references / SharePoint register,Configuration inventory,Current inventory with owner and status.,AI capabilities in production,You cannot govern what you have not inventoried.
OBS-IG2-04,AI Observability,IG2,Configuration drift review,Catch when controls change after launch.,"Review whether key AI settings, connector states, browser controls, and access restrictions remain aligned to approved baseline.",QBR,Monthly or quarterly,Security/admin lead,Defender / Entra / Purview / admin center exports,Configuration management / compliance monitoring,Drift review and remediation actions.,Customer environment,Important once multiple admins and departments are involved.
OBS-IG3-01,AI Observability,IG3,Cross-tool correlation,"Correlate AI usage with data movement, endpoint, and identity signals for stronger investigations.","Link AI-related observations to endpoint, identity, and data security events to understand context and risk.",Security Incident,Continuous with quarterly review,Security operations,Microsoft Sentinel / Defender / Purview,SIEM / XDR / UEBA,Correlated investigation workflow and evidence examples.,Sensitive environments,"Advanced, but valuable for higher-risk customers."
OBS-IG3-02,AI Observability,IG3,Automated anomaly detection,Look for meaningful deviations in AI behavior over time.,"Use analytics to flag unusual spikes in AI usage, unusual departments, abnormal data interactions, or new unsanctioned tools.",QBR,Quarterly tuning,Security/data analytics lead,Sentinel analytics / Power BI anomaly views,Behavior analytics / UEBA,Documented anomaly rules and review output.,Mature customer environments,"This is an advanced overlay, not a starting point."
DEP-IG1-01,AI Tooling & Deployment,IG1,Named pilot with training,Deploy to a trained customer cohort before broad release.,Enable AI only for a named pilot group that has completed starter training and knows the support path.,Onboarding,Per rollout wave,Project lead + department manager,Entra groups; Viva Learning / Microsoft 365 training resources,LMS / identity groups,Pilot roster and training completion list.,Pilot users,Pilot quality matters more than pilot size.
DEP-IG1-02,AI Tooling & Deployment,IG1,Deployment rings,Use staged rollout waves inside the customer environment.,"Create rollout rings such as IT/champions, pilot department, and broader departments with explicit expansion criteria.",Project,Per rollout wave,IT lead,Entra groups; M365 admin licensing,Release / cohort management,Ring plan and targeted groups.,Enabled users,This makes rollback and support more manageable.
DEP-IG1-03,AI Tooling & Deployment,IG1,Role-based user training path,Match enablement to what employees actually do.,"Provide role-based training that covers approved use cases, limitations, prohibited data, and escalation paths for each employee cohort.",Employee Onboarding,"At launch for existing staff, then per new employee and annual refresh",Department manager + enablement lead,Viva Learning / SharePoint,LMS / enablement platform,Training curriculum and completion record.,Enabled employees,"Training should be tied to role, not only to the product brand."
DEP-IG1-04,AI Tooling & Deployment,IG1,Support runbook,Make sure employees know how AI issues are handled.,"Publish a support runbook that defines where employees report AI issues, how incidents are categorized, and expected triage path.",Onboarding,Quarterly refresh,Service owner,Teams + SharePoint + ticketing integrations,ITSM / support knowledge base,Published runbook and support category.,Enabled employees,Treat AI issues as supportable events.
DEP-IG2-01,AI Tooling & Deployment,IG2,Connector approval path,Control which systems AI can reach in the customer environment.,"Require approval before enabling connectors, plugins, actions, or external data paths that expand AI access.",Project,Per connector or action,Platform owner + data owner,Copilot Studio / Power Platform admin / M365 admin controls,Integration governance,Connector approval record and inventory update.,Connectors and plugins,Data path expansion is often the biggest real risk increase.
DEP-IG2-02,AI Tooling & Deployment,IG2,Dev/test/prod promotion path,"Prevent unfinished prompts, agents, or automations from reaching employees.","Use a promotion path for custom prompts, automations, and agents so production changes are tested before release.",Project,Per release,Platform owner,Copilot Studio / Power Platform environments,SDLC / release management,"Release checklist, tester signoff, and promotion record.",Custom AI features,A separate pilot ring is the minimum if full environment separation is not possible.
DEP-IG2-03,AI Tooling & Deployment,IG2,Role-based expansion gate,Expand deployment only when the next employee cohort is ready.,"Require that each new role or department has completed training, accepted policy, and met data-readiness prerequisites before enablement.",Employee Onboarding,Per new cohort,Department manager + IT lead,Entra groups; Viva Learning; SharePoint checklist,Cohort readiness / LMS,Signed enablement gate or checklist.,New departments / employee cohorts,"Rollout should follow readiness, not just license availability."
DEP-IG2-04,AI Tooling & Deployment,IG2,Rollback rehearsal,Test the customer’s ability to pause or reverse a rollout.,"Run a rehearsal that confirms groups, licenses, access paths, and support comms can be rolled back cleanly if needed.",Project,Before major expansion and annual refresh,IT lead,Entra / M365 admin center,Release management / DR rehearsal,Rollback rehearsal record.,Production rollout,"If rollback is never tested, it is partly theoretical."
DEP-IG3-01,AI Tooling & Deployment,IG3,Agent lifecycle register,Track every production agent or custom AI workflow over time.,"Maintain a lifecycle register for each production agent or automation including owner, purpose, data scope, review date, and retirement path.",Project,Monthly review,Platform owner,Copilot Studio / SharePoint register,Application lifecycle management,Current lifecycle register with no unknown owners.,Production agents and automations,"The lifecycle needs to include retirement, not just launch."
DEP-IG3-02,AI Tooling & Deployment,IG3,Employee offboarding AI access removal,Remove AI access and related exceptions cleanly when employees leave or change roles.,"Ensure user offboarding removes AI licenses, agent access, custom exceptions, shared secrets, and elevated roles tied to AI capabilities.",Employee Offboarding,Per departing employee or role change,Identity admin + manager,Entra ID; M365 admin center; Copilot Studio access review,IAM / offboarding workflow,Offboarding checklist with completed removals.,Departing employees,"This is a customer environment lifecycle step, not an MSP back-office task."
